{
  "$schema": "https://json-schema.org/draft/2020-12/schema",
  "title": "Software factory project config (.factory/config.json)",
  "description": "Declares how a project fills the factory contract. Globs: `*` and `**` match any characters including `/`, `**/` also matches zero directories, `?` matches one character. The classifier always reads this file from the base branch, never from a PR.",
  "type": "object",
  "required": ["version", "owners", "check"],
  "additionalProperties": false,
  "properties": {
    "version": { "const": 1 },
    "owners": {
      "description": "GitHub logins the gate assigns and mentions on PRs above the autoMerge level; only their `merge` label lets such a PR merge.",
      "type": "array",
      "items": { "type": "string", "minLength": 1 },
      "minItems": 1
    },
    "autoMerge": {
      "description": "The highest impact level the gate merges without an owner's `merge` label. `low` (default): every PR a rule fires on waits for an owner. `medium`: dependency, spec, size and Observed changes merge when green too — for hobby projects and prototypes. High impact (guardrails, sensitive paths, migrations, weakened tests, unresolved review findings) always waits.",
      "enum": ["low", "medium"],
      "default": "low"
    },
    "check": {
      "description": "The one command that must pass locally and in CI, byte for byte. Run from the project root.",
      "type": "string",
      "minLength": 1
    },
    "fix": {
      "description": "Run after every edit on files matching `glob`. `{file}` is replaced with the quoted path relative to the root. Must stay fast (seconds); exit non-zero when problems remain.",
      "type": "array",
      "items": {
        "type": "object",
        "required": ["glob", "command"],
        "additionalProperties": false,
        "properties": {
          "glob": { "type": "string", "minLength": 1 },
          "command": { "type": "string", "minLength": 1 }
        }
      }
    },
    "setup": {
      "description": "Prepares a fresh worktree so the project runs in it.",
      "type": "object",
      "additionalProperties": false,
      "properties": {
        "command": { "type": "string" },
        "copy": {
          "description": "Gitignored files copied from the main checkout into a new worktree (e.g. .env). Copied by the factory script, never read by an agent.",
          "type": "array",
          "items": { "type": "string" }
        }
      }
    },
    "block": {
      "description": "Project-specific commands the agent may never run (extended regex on the whitespace-normalised Bash command).",
      "type": "array",
      "items": {
        "type": "object",
        "required": ["pattern"],
        "additionalProperties": false,
        "properties": {
          "pattern": { "type": "string", "minLength": 1 },
          "reason": { "type": "string" }
        }
      }
    },
    "paths": {
      "type": "object",
      "additionalProperties": false,
      "properties": {
        "migrations": { "$ref": "#/$defs/globs", "description": "Touching these makes a PR high impact." },
        "sensitive": { "$ref": "#/$defs/globs", "description": "Auth, payments, data deletion, signature checks, prompts… Touching these makes a PR high impact." },
        "guardrails": { "$ref": "#/$defs/globs", "description": "Project guardrail files beyond the built-in list (linter configs, check scripts, Makefile). High impact." },
        "dependencies": { "$ref": "#/$defs/globs", "description": "Dependency manifests beyond the built-in list. Medium impact." },
        "generated": { "$ref": "#/$defs/globs", "description": "Excluded from the size count." },
        "tests": { "$ref": "#/$defs/globs", "description": "Test files beyond the built-in patterns, for the deleted-tests rule." }
      }
    },
    "limits": {
      "type": "object",
      "additionalProperties": false,
      "properties": {
        "lines": { "type": "integer", "minimum": 1, "default": 400, "description": "Above this many changed lines (or `files` files) a PR is medium impact." },
        "files": { "type": "integer", "minimum": 1, "default": 20 }
      }
    },
    "review": {
      "type": "object",
      "additionalProperties": false,
      "properties": {
        "model": { "type": "string", "description": "Model for the reviewer and judges. Default: opus." },
        "maxTurns": { "type": "integer", "minimum": 1 }
      }
    },
    "run": {
      "type": "object",
      "additionalProperties": false,
      "properties": {
        "model": { "type": "string", "description": "Model for unattended implementation runs. Default: your default model." },
        "maxAttempts": { "type": "integer", "minimum": 1, "default": 3, "description": "Attempts at a ticket (counted on GitHub, since it last finished one or was blocked) before it blocks for the owner." },
        "staleMinutes": { "type": "integer", "minimum": 1, "default": 120, "description": "An attempt that has not ended counts as live, and keeps other attempts from starting, until this long after it started or after the last commit on its branch. After that it is resumed as crashed." },
        "maxTurns": { "type": "integer", "minimum": 1, "default": 80 },
        "baseBranch": { "type": "string", "default": "main" }
      }
    }
  },
  "$defs": {
    "globs": { "type": "array", "items": { "type": "string", "minLength": 1 } }
  }
}
